text,alpha2_code,language_code,date,cluster,country,tokens,state
"Les mercenaires de Wagner ont ""toujours été présents en Ukraine ... - franceinfo",CH,fr,2022-03-01,Current Information War,Switzerland,20,Saxony
Guerre en Ukraine: Google Maps désactive les données routières dans le pays pour protéger la population - - Juno7 Haïti,CH,fr,2022-03-01,Volunteering and Donations,Switzerland,31,Thurgau
"Italie : « Ceux qui fuient l'Ukraine sont de vrais réfugiés, pas comme ... - Senego.com - Actualité au Sénégal",CH,fr,2022-03-01,Current Information Refugees,Switzerland,36,Valais
Flucht aus der Ukraine | Fünf Grundsätze für den Umgang ... - Amnesty International,CH,de,2022-03-01,Volunteering and Donations,Switzerland,21,Geneva
Schwarze Menschen in der Ukraine berichten über Rassismus beim ... - Global Citizen,CH,de,2022-03-01,Current Information Refugees,Switzerland,19,Bern
Nach der Ankunft in Tschechien: Hilfszentren für Flüchtlinge aus der ... - Radio Prague,CH,de,2022-03-01,Local Communities,Switzerland,26,Appenzell Innerrhoden
"Ukraine-Krieg: Unternehmer organisieren Jobs, Spenden und Unterkünfte für ukrainische Flüchtlinge - Handelsblatt",CH,de,2022-03-01,Local Communities,Switzerland,33,Solothurn
Ukraine-Flüchtlinge dürfen Fernzüge auf 40 Routen kostenlos nutzen - RND,CH,de,2022-03-01,Current Information Refugees,Switzerland,24,Saarland
Afrikaner in der Ukraine: Geflüchtete zweiter Klasse - Berliner Morgenpost,CH,de,2022-03-01,Current Information Refugees,Switzerland,23,Schwyz
Krieg in der Ukraine: Kann Polen den Flüchtlingsansturm bewältigen? - MDR,CH,de,2022-03-01,Current Information Refugees,Switzerland,24,Thuringia
Ukraine-Krieg: Tagelanges Bangen – Junger Frau gelingt die Flucht ... - Merkur.de,CH,de,2022-03-01,Children and Human Rights,Switzerland,24,Thuringia
Wolfenbüttel: Frau mit verzweifelter Bitte – ihre Oma muss aus der Ukraine fliehen - News38,CH,de,2022-03-01,Children and Human Rights,Switzerland,28,Sankt Gallen
Bündner stampfen Hilfswerk für die Ukraine aus dem Boden - suedostschweiz.ch,CH,de,2022-03-01,Volunteering and Donations,Switzerland,23,Vaud
Vorbereitet auf die Ankunft der Ukraine-Flüchtlinge - kreiszeitung.de,CH,de,2022-03-01,Local Communities,Switzerland,22,Geneva
Ostholstein: Kommunen suchen Wohnungen für Flüchtlinge aus der Ukraine - Lübecker Nachrichten,CH,de,2022-03-01,Local Communities,Switzerland,27,Schaffhausen
Russischer Angriffskrieg: Warum junge Ukrainer in ihrer Heimat bleiben wollen - FAZ - Frankfurter Allgemeine Zeitung,CH,de,2022-03-01,Children and Human Rights,Switzerland,31,Lucerne
Polen empfängt Flüchtlinge aus Ukraine – «Vielleicht das grösste ... - Der Landbote,CH,de,2022-03-01,Current Information Refugees,Switzerland,26,Rhineland-Palatinate
Krieg in Ukraine: Lettlands Rundfunk zeigt Nachrichten auf Ukrainisch - RND,CH,de,2022-03-01,Current Information War,Switzerland,21,Thuringia
Stand with Ukraine: So kannst du helfen - MUCBOOK - MUCBOOK,CH,de,2022-03-01,Volunteering and Donations,Switzerland,16,Basel
Ukraine-Krieg: Polizei warnt vor Anschlägen in Deutschland - zdf.de,CH,de,2022-03-01,Volunteering and Donations,Switzerland,21,Basel
Von Kriegsopfern erster und zweiter Klasse - Übermedien,CH,de,2022-03-01,Volunteering and Donations,Switzerland,18,Lower Saxony
Stuttgart bereitet sich auf Flüchtlinge vor: Die Stadt sucht Wohnraum ... - Stuttgarter Nachrichten,CH,de,2022-03-01,Local Communities,Switzerland,27,Zug
Unterstützung für die Menschen in der Ukraine: »Konstanz hilft!« ist ... - Singener Wochenblatt,CH,de,2022-03-01,Volunteering and Donations,Switzerland,27,Brandenburg
Ukrainer in Deutschland: „Viele Männer sind in die Ukraine ... - WELT,CH,de,2022-03-01,Volunteering and Donations,Switzerland,19,Hamburg
Welche Spenden Flüchtlingen aus der Ukraine benötigen: „Zum ... - fr.de,CH,de,2022-03-01,Local Communities,Switzerland,21,Baden-Württemberg
Aus der Ukraine nach Walterschen geflüchtet: Ferienwohnung wird ... - AK-Kurier - Internetzeitung für den Kreis Altenkirchen,CH,de,2022-03-01,Volunteering and Donations,Switzerland,36,Vaud
Lengenfelder Hilfsverein Unterkarpaten bittet um Spenden für die ... - freiepresse.de,CH,de,2022-03-01,Volunteering and Donations,Switzerland,29,Hesse
Krieg in der Ukraine: action medeor unterstützt vor Ort und hat ... - KV Nordrhein,CH,de,2022-03-01,Current Information War,Switzerland,22,Geneva
Erste Ukrainer an der Müritz angekommen - Nordkurier,CH,de,2022-03-01,Volunteering and Donations,Switzerland,14,Fribourg
Ukraine-Hilfe: Ankunftshalle für Infos - ORF,CH,de,2022-03-01,Volunteering and Donations,Switzerland,15,North Rhine-Westphalia
Krieg in der Ukraine: Wie München hilft - Abendzeitung,CH,de,2022-03-01,Volunteering and Donations,Switzerland,15,Basel
Unterstützung für LGBTIs im Kriegsgebiet: Bündnis sammelt ... - Tagesspiegel,CH,de,2022-03-01,Accomodation,Switzerland,26,Uri
Land Sachsen-Anhalt stellt Unterkunft für Flüchtlinge aus Ukraine ... - TAG24,CH,de,2022-03-01,Local Communities,Switzerland,21,Schleswig-Holstein
Ukrainische Geflüchtete können Abellio-Bahnen kostenfrei für die ... - Du bist Halle,CH,de,2022-03-01,Current Information Refugees,Switzerland,26,Appenzell Ausserrhoden
Dresden zeigt Herz! Riesige Hilfswelle für Kriegsflüchtlinge aus der ... - TAG24,CH,de,2022-03-01,Local Communities,Switzerland,27,Hamburg
Ruf nach humanitären Korridoren für Ukraine-Flüchtlinge - Vatican News - Deutsch,CH,de,2022-03-01,Local Communities,Switzerland,22,Zurich
Slowakei: Kurienerzbischof besucht ukrainische Grenzstation - Vatican News - Deutsch,CH,de,2022-03-01,Refugee Routes from Ukraine,Switzerland,25,Lucerne
Zürich bereitet sich auf Flüchtlinge aus der Ukraine vor - Limmattaler Zeitung,CH,de,2022-03-01,Current Information Refugees,Switzerland,23,Schwyz
Ukraine-Russland: Der Krieg verschont die Kinder nicht - watson,CH,de,2022-03-01,Children and Human Rights,Switzerland,17,Solothurn
Ukraine-Krieg: Stadt sucht Wohnungen für Flüchtlinge - und erlebt ... - Merkur.de,CH,de,2022-03-01,Local Communities,Switzerland,24,Basel
Die Ukraine will in die EU: Ist ein schneller Beitritt realistisch? - WDR Nachrichten,CH,de,2022-03-01,Refugee Routes from Ukraine,Switzerland,22,Schleswig-Holstein
Lübeck: UKSH und Forum für Migranten bekunden Solidarität für Flüchtlinge - Lübecker Nachrichten,CH,de,2022-03-01,Accomodation,Switzerland,30,Appenzell Innerrhoden
Krieg gegen die Ukraine: So hilft der Landkreis Harburg den Menschen in der Ukraine - Hamburger Abendblatt,CH,de,2022-03-01,Current Information War,Switzerland,27,Basel
Flucht aus der Ukraine: Warum Brandenburgs Aufnahmeeinrichtungen noch leer sind - Märkische Allgemeine Zeitung,CH,de,2022-03-01,Volunteering and Donations,Switzerland,30,Grisons
#standwithukraine: Aufruf zu Sachspenden für die Menschen in der ... - FH Kiel,CH,de,2022-03-01,Volunteering and Donations,Switzerland,24,Schleswig-Holstein
Hilfsaktion: Oldenburg hilft der Ukraine - Oldenburger Onlinezeitung,CH,de,2022-03-01,Volunteering and Donations,Switzerland,18,Berlin
Bundespolitik im Krisenmodus: Diplomatischer Hochbetrieb und Debatte über die Bundeswehr - MDR,CH,de,2022-03-01,Volunteering and Donations,Switzerland,30,Lucerne
Ukraine-Krieg: Baerbock ruft die Welt zur Ächtung Russlands auf - STERN.de,DE,de,2022-03-01,Sanktions Russia and War Strategy,Germany,24,Fribourg
Rügen schickt Hilfsladungen an die ukrainische Grenze: Transporter benötigt - Ostsee Zeitung,DE,de,2022-03-01,Volunteering and Donations,Germany,27,Bavaria
Russisch-orthodoxe Gemeinde in Potsdam wirbt um Spenden für die Ukraine - rbb24,DE,de,2022-03-01,Statements by the Church,Germany,24,Glarus
Ukrainische Flüchtlinge beherbergen: Rund 4000 melden sich - St.Galler Tagblatt,CH,de,2022-03-01,Local Communities,Switzerland,29,Zurich
Arzt will in seiner Ergolz-Klinik Ukrainer aufnehmen - Kanton muss ... - bz Basel - Nachrichten Region Basel,CH,de,2022-03-01,Volunteering and Donations,Switzerland,27,Hesse
"Krieg in der Ukraine - Geld, Kleider, Hilfseinsatz: Wie Sie der ... - SRF – Schweizer Radio und Fernsehen",CH,de,2022-03-01,Current Information War,Switzerland,31,Baden-Württemberg
Hilfe für die Ukraine: Das kann man in St.Gallen tun - St.Galler Tagblatt,CH,de,2022-03-01,Volunteering and Donations,Switzerland,22,Schleswig-Holstein
Kolping unterstützt ukrainische Binnenflüchtlinge - DOMRADIO.DE - DOMRADIO.DE,CH,de,2022-03-01,Local Communities,Switzerland,26,Schleswig-Holstein
Ukraine-Krieg: Sachsen-Anhalt bringt Flüchtlinge nach Halberstadt - Volksstimme,CH,de,2022-03-01,Current Information Refugees,Switzerland,25,Jura
Landkreis Rosenheim sucht freien Wohnraum für Ukraine-Flüchtlinge - Hötzelsperger / Nitzsche,CH,de,2022-03-01,Local Communities,Switzerland,30,Appenzell Innerrhoden
Solidarität mit Ukraine groß: Viele Hilfsaktionen in BW - SWR Aktuell,CH,de,2022-03-01,Volunteering and Donations,Switzerland,20,Schleswig-Holstein
Nach der Ankunft in Tschechien: Hilfszentren für Flüchtlinge aus der ... - deutsch.radio.cz,DE,de,2022-03-01,Local Communities,Germany,27,Lucerne
"Russland-Ukraine-Krieg: Bomben auf Charkiw, Einstieg der ... - DER SPIEGEL",DE,de,2022-03-01,Sanktions Russia and War Strategy,Germany,24,Obwalden
Wickede: „Längste Kuchentheke“ für die Ukraine-Flüchtlinge - soester-anzeiger.de,DE,de,2022-03-01,Local Communities,Germany,30,Lower Saxony
"Knossi, Sido, Capital Bra und Kontra K arbeiten zusammen um der ... - RAPTASTISCH",DE,de,2022-03-01,Volunteering and Donations,Germany,25,Sankt Gallen
Wladimir Putin: Flucht aus Moskau? Kreml-Chef verschanzt sich angeblich in Bunker - news.de,DE,de,2022-03-01,Sanktions Russia and War Strategy,Germany,30,Thurgau
Krieg gegen Ukraine: Wie die Klitschkos Putins Todfeinde wurden - Hamburger Abendblatt,DE,de,2022-03-01,Sanktions Russia and War Strategy,Germany,24,Uri
Der Ukrainekrieg und die Auswirkungen auf Sachsen: „Vor uns steht ... - Leipziger Internet-Zeitung,CH,de,2022-03-01,Current Information War,Switzerland,29,Bremen
"« Les autorités faisaient le tri » : à la frontière ukrainienne, des ... - La Croix",CH,fr,2022-03-01,Volunteering and Donations,Switzerland,26,Basel
Fuir l'Ukraine - rts.ch - Monde - RTS.ch,CH,fr,2022-03-01,Volunteering and Donations,Switzerland,16,Lucerne
Guerre en Ukraine : Madrid s'engage à accueillir des réfugiés ... - RTBF,CH,fr,2022-03-01,Current Information Refugees,Switzerland,24,Zug
Guerre en Ukraine : les premiers réfugiés arrivent en France - Europe 1,CH,fr,2022-03-01,Current Information Refugees,Switzerland,21,Solothurn
Guerre en Ukraine : où et comment venir en aide aux réfugiés près de chez vous en Occitanie ? - Midi Libre,CH,fr,2022-03-01,Local Communities,Switzerland,29,Vaud
Peu d'options pour les réfugiés ukrainiens espérant venir au Canada - Le Devoir,CH,fr,2022-03-01,Local Communities,Switzerland,24,Vaud
Guerre en Ukraine : la Belgique en appelle à la solidarité citoyenne ... - RTBF,CH,fr,2022-03-01,Volunteering and Donations,Switzerland,24,Rhineland-Palatinate
Guerre en Ukraine : quels dons faut-il faire pour aider les réfugiés ... - France 3 Régions,CH,fr,2022-03-01,Local Communities,Switzerland,28,Jura
Plusieurs communes de Bruxelles apportent leur soutien aux ... - BX1,CH,fr,2022-03-01,Refugee Routes from Ukraine,Switzerland,19,Mecklenburg-Vorpommern
"Avec les réfugiés ukrainiens: «Pour notre exil, la Pologne allait de soi» - Libération",CH,fr,2022-03-01,Current Information Refugees,Switzerland,30,Neuchâtel
Ukraine : le Grand-Duché se prépare à la vague de réfugiés - Le Quotidien.lu,CH,fr,2022-03-01,Local Communities,Switzerland,26,Basel
Réfugiés ukrainiens « J'espère que nous allons bientôt pouvoir ... - L'Humanité,CH,fr,2022-03-01,Local Communities,Switzerland,27,Geneva
Guerre en Ukraine : la préfecture du Haut-Rhin va coordonner l ... - France 3 Régions,CH,fr,2022-03-01,Current Information War,Switzerland,27,Sankt Gallen
"GARD Accueil de réfugiés ukrainiens : le Département va ""recenser ... - Objectif Gard",CH,fr,2022-03-01,Local Communities,Switzerland,27,Rhineland-Palatinate
Pontarlier. Guerre en Ukraine : une chaîne de solidarité toujours plus grande pour les réfugiés ... - Est Républicain,CH,fr,2022-03-01,Local Communities,Switzerland,32,Solothurn
Savoie. Guerre en Ukraine : Saint-Colomban-des-Villards prête à ... - Le Dauphiné Libéré,CH,fr,2022-03-01,Current Information War,Switzerland,29,Thuringia
Station F propose son aide aux entrepreneurs ukrainiens réfugiés - Maddyness,CH,fr,2022-03-01,Local Communities,Switzerland,19,Saxony
Les Roumains mobilisés pour aider les réfugiés ukrainiens - Vatican News - Français,CH,fr,2022-03-01,Refugee Routes from Ukraine,Switzerland,24,Schaffhausen
Guerre en Ukraine : les trains seront gratuits en Belgique pour les ... - RTBF,CH,fr,2022-03-01,Volunteering and Donations,Switzerland,19,Rhineland-Palatinate
Guerre en Ukraine : la préfecture de la Haute-Saône lance un appel ... - France 3 Régions,CH,fr,2022-03-01,Current Information War,Switzerland,29,Bavaria
«On nous disait “Pas les Noirs”»: le tri racial dans la fuite de l'Ukraine | Slate.fr - Slate.fr,CH,fr,2022-03-01,Current Information Refugees,Switzerland,31,Geneva
Guerre en Ukraine: où faire des dons pour les réfugiés dans les Alpes du Sud? - BFM DICI,CH,fr,2022-03-01,Local Communities,Switzerland,29,Schleswig-Holstein
"La Région, solidaire, se mobilise pour le peuple ukrainien ! - Région Centre-Val de Loire",CH,fr,2022-03-01,Volunteering and Donations,Switzerland,31,North Rhine-Westphalia
Ukraine : le comité de jumelage Millau-Plopeni lance un appel aux dons pour les réfugiés ukrainiens - Midi Libre,CH,fr,2022-03-01,Local Communities,Switzerland,34,Bern
"Solidarité. Depuis Beaune, un jeune Ukrainien collecte des dons ... - Le Bien Public",CH,fr,2022-03-01,Volunteering and Donations,Switzerland,23,Rhineland-Palatinate
Comment venir en aide à l'Ukraine dans le pays de Lorient ? - Le Télégramme,CH,fr,2022-03-01,Volunteering and Donations,Switzerland,21,Bavaria
Voici comment Toulouse veut aider Kiev et l'Ukraine - Le Journal Toulousain,CH,fr,2022-03-01,Volunteering and Donations,Switzerland,20,Sankt Gallen
Soutien à l'Ukraine : la campagne de solidarité se réoriente - Ville - Ville de Bourg-en-Bresse,CH,fr,2022-03-01,Volunteering and Donations,Switzerland,30,Appenzell Ausserrhoden
Vosges. Guerre en Ukraine : plusieurs points de collecte au profit des réfugiés dans l’agglomération ... - Vosges Matin,CH,fr,2022-03-01,Local Communities,Switzerland,35,Basel
Rhône. Guerre en Ukraine : comment aider depuis Lyon et sa région ? - Le Progrès,CH,fr,2022-03-01,Volunteering and Donations,Switzerland,22,North Rhine-Westphalia
"Guerre en Ukraine: les titres de séjour des Ukrainiens en France prolongés ""d'au moins 90 jours"" - BFMTV",CH,fr,2022-03-01,Refugee Routes from Ukraine,Switzerland,32,North Rhine-Westphalia
La Turquie interdit le passage des Dardanelles et du Bosphore aux navires de guerre - RTS.ch,CH,fr,2022-03-01,Accomodation,Switzerland,27,Rhineland-Palatinate
Guerre en Ukraine : les trains également gratuits aux Pays-Bas pour ... - RTBF,CH,fr,2022-03-01,Volunteering and Donations,Switzerland,19,Bavaria
"L’offensive russe se poursuit en Ukraine, Moscou fait face à des sanctions occidentales de plus en plus sévères - La Croix",CH,fr,2022-03-01,Sanktions Russia and War Strategy,Switzerland,32,Vaud
La colère africaine devant la “ségrégation de la honte” aux frontières ... - Courrier international,CH,fr,2022-03-01,Migration Apart from Ukraine,Switzerland,27,Bern
La solidarité s'organise: voici comment aider le peuple ukrainien ... - Metro Belgique,CH,fr,2022-03-01,Volunteering and Donations,Switzerland,25,Rhineland-Palatinate
Guerre en Ukraine : comment la solidarité s'organise en Auvergne - France 3 Régions,CH,fr,2022-03-01,Current Information War,Switzerland,26,Obwalden
La CFDT est solidaire des Ukrainiens - Syndicalisme Hebdo,CH,fr,2022-03-01,Volunteering and Donations,Switzerland,16,Geneva
Des organismes prêts à aider les réfugiés ukrainiens et leurs animaux - La Presse,CH,fr,2022-03-01,Local Communities,Switzerland,25,North Rhine-Westphalia
La fin du périple de deux Ukrainiennes à Bruxelles: «On a voulu ... - Le Soir,CH,fr,2022-03-01,Volunteering and Donations,Switzerland,25,Schaffhausen
"Guerre en Ukraine : Otan, HCR, qui fait quoi pour venir en aide aux ... - Sud Ouest",CH,fr,2022-03-01,Current Information War,Switzerland,25,North Rhine-Westphalia
"Guerre en Ukraine : en France, les cours d'Histoire abordent la ... - franceinfo",CH,fr,2022-03-01,Refugee Routes from Ukraine,Switzerland,23,Zurich
Ukraine : Quand les médias occidentaux prêchent élitisme ... - Yabiladi,CH,fr,2022-03-01,Current Information War,Switzerland,23,Grisons
Erste Geflüchtete aus der Ukraine in Münster angekommen - Westfälische Nachrichten,DE,de,2022-03-01,Local Communities,Germany,23,Schwyz
Vogtlandkreis sucht Wohnraum für Flüchtlinge aus der Ukraine - freiepresse.de,DE,de,2022-03-01,Local Communities,Germany,25,Thuringia
Velbert: IHLA holt Flüchtlinge an der ukrainischen Grenze ab - WAZ News,DE,de,2022-03-01,Local Communities,Germany,26,Baden-Württemberg
Krieg in der Ukraine: Im Grenzdurchgangslager Friedland rückt man ... - hna.de,DE,de,2022-03-01,Current Information War,Germany,24,Brandenburg
wunderflats organisiert unbürokratisch Unterkünfte für ... - Konii.de,DE,de,2022-03-01,Volunteering and Donations,Germany,21,Obwalden
"Amira Pocher will Ukraine-Flüchtlinge bei sich aufnehmen, hat aber ... - TAG24",DE,de,2022-03-01,Local Communities,Germany,24,Bern
Les résidents d’origine africaine sont-ils empêchés de quitter l’Ukraine? - Libération,CH,fr,2022-03-01,Current Information Refugees,Switzerland,28,Appenzell Innerrhoden
Guerre en Ukraine : des Français prêts à accueillir des réfugiés ... - franceinfo,CH,fr,2022-03-01,Current Information Refugees,Switzerland,26,Aargau
Pas-de-Calais : un migrant meurt percuté par un train - LaDepeche.fr,CH,fr,2022-03-01,Problems Refugee Management,Switzerland,21,Bremen
Migrants : un message contre les préjugés dans le roman de Maïa ... - Paris-Normandie,CH,fr,2022-03-01,Problems Refugee Management,Switzerland,24,Saxony-Anhalt
Ukraine-Hilfe: Neustadt richtet zentrale E-Mail für Unterstützer und Hilfsangebote ein - HAZ,DE,de,2022-03-01,Volunteering and Donations,Germany,29,Geneva
Solidaritätswelle in Tschechien: Neue Liebe der Prager Politik für ... - OberpfalzECHO,DE,de,2022-03-01,Refugee Routes from Ukraine,Germany,27,North Rhine-Westphalia
"Rzeszów, la più grande città polacca del confine sud est che ... - Open Migration",CH,it,2022-03-01,Refugee Routes from Ukraine,Switzerland,22,Appenzell Innerrhoden
"Migranti, Grupa Granica: la Polonia accoglie gli ucraini, respinge gli altri - Redattore Sociale",CH,it,2022-03-01,Current Information Refugees,Switzerland,31,Bremen
Come si sta organizzando Milano per aiutare i profughi ucraini - MilanoToday.it,CH,it,2022-03-01,Local Communities,Switzerland,23,Nidwalden
Cremona Pianeta Migranti. Benvenuti i profughi ucraini ma non gli ... - WelfareNetwork,CH,it,2022-03-01,Problems Refugee Management,Switzerland,28,Jura
"Guerra in Ucraina, migliaia i profughi in Romania - Save the Children Italia",CH,it,2022-03-01,Refugee Routes from Ukraine,Switzerland,21,Appenzell Ausserrhoden
"Profughi dall’Ucraina a Milano, luoghi, email e siti web per gli aiuti: Comune, consolato, Caritas,... - Corriere Milano",CH,it,2022-03-01,Volunteering and Donations,Switzerland,38,Berlin
"La Polonia accoglie i rifugiati ucraini, l'Ue la punisce - La Nuova Bussola Quotidiana",CH,it,2022-03-01,Current Information Refugees,Switzerland,33,Baden-Württemberg
"Guerra in Ucraina, ecco i luoghi per accogliere i profughi a Firenze ... - InToscana",CH,it,2022-03-01,Current Information Refugees,Switzerland,31,Brandenburg
"L'Ue apre le porte ai profughi ucraini grazie alla ""protezione ... - Stranieri in Italia",CH,it,2022-03-01,Current Information Refugees,Switzerland,30,Lucerne
"Solidarietà. Partono le raccolte degli aiuti per l'Ucraina, attenti agli ... - Avvenire",CH,it,2022-03-01,Volunteering and Donations,Switzerland,28,Zug
"Luca Casarini: «Accoglienza sempre, nessuna differenza tra profughi di guerra. Altrimenti siamo mostri» - PadovaOggi",CH,it,2022-03-01,Accomodation,Switzerland,38,Zurich
Ucraina: centinaia di migliaia in fuga dalla guerra - Vatican News - Italiano,CH,it,2022-03-01,Volunteering and Donations,Switzerland,22,Neuchâtel
Il discorso integrale di Mario Draghi sull'Ucraina in Senato - Corriere della Sera,CH,it,2022-03-01,Current Information War,Switzerland,25,Glarus
"Guerra in Ucraina, dalla Bielorussia a Cuba: ecco chi sono gli alleati di Putin - Sky Tg24",CH,it,2022-03-01,Sanktions Russia and War Strategy,Switzerland,28,Grisons
Il razzismo verso i rifugiati neri al confine tra Ucraina e Polonia - Cosmopolitan,CH,it,2022-03-01,Current Information Refugees,Switzerland,25,Valais
Ucraina: la situazione dei bambini e delle famiglie coinvolte nell ... - UNICEF Italia,CH,it,2022-03-01,Children and Human Rights,Switzerland,25,Bern
Ucraina: cosa sappiamo finora - RSI.ch Informazione,CH,it,2022-03-01,Volunteering and Donations,Switzerland,16,Thurgau
"Guerra Ucraina: ricarica gratis Tesla in 4 Supercharger, ecco dove - SicurAUTO.it",CH,it,2022-03-01,Current Information War,Switzerland,25,Grisons
"Ucraina, da Kharkiv al Donbass è anche allarme cibo e medicine - Dire",CH,it,2022-03-01,Volunteering and Donations,Switzerland,22,Baden-Württemberg
Da Mitsotakis un C-130 di armi a Kiev. Syriza: «Così partecipiamo al ... - Il Manifesto,CH,it,2022-03-01,Current Information War,Switzerland,31,Saxony
"Profughi dall’Ucraina, Ciac: ""Chi può metta a disposizione una struttura"" - Video: gli aiuti alla Croce rossa - Gazzetta di Parma",CH,it,2022-03-01,Volunteering and Donations,Switzerland,43,Thurgau
"Guerra Russia-Ucraina, anche Norvegia e Finlandia inviano armi a Kiev - Sky Tg24",CH,it,2022-03-01,Sanktions Russia and War Strategy,Switzerland,25,Ticino
"Ucraina: la cronaca, LA DIRETTA della giornata - Agenzia ANSA",CH,it,2022-03-01,Volunteering and Donations,Switzerland,22,Schleswig-Holstein
Onu: in Ucraina crisi umanitaria per 4 milioni di persone - Euronews Italiano,CH,it,2022-03-01,Current Information War,Switzerland,26,Hamburg
Ucraina sotto attacco: la vita nei rifugi e in fuga verso l'ovest - Diocesi di MIlano,CH,it,2022-03-01,Volunteering and Donations,Switzerland,29,Schaffhausen
Boom di immigrati nel 2021. Quasi 90mila nuovi clandestini in Italia: l'allarme dei servizi segreti - Il Tempo,CH,it,2022-03-01,Migration Apart from Ukraine,Switzerland,34,Neuchâtel
"Ucraina, la grande solidarietà dei romani: lunga fila di auto per portare aiuti alla chiesa di Santa Sofia - Corriere TV",CH,it,2022-03-01,Statements by the Church,Switzerland,34,Sankt Gallen
"Come aiutare i profughi ucraini in Campania: raccolte vestiti, farmaci ... - Fanpage.it",CH,it,2022-03-01,Local Communities,Switzerland,30,Hesse
"Lanciano si mobilita per aiutare la popolazione Ucraina, partirà ... - Abruzzo in Video",CH,it,2022-03-01,Volunteering and Donations,Switzerland,28,Bavaria
Consolato Ucraino a Napoli cerca volontari in tutto il Sud: come ... - Vesuvio Live,CH,it,2022-03-01,Volunteering and Donations,Switzerland,24,Uri
Per Toninelli “l’Ucraina è già parte della Ue”. Ennesima gaffe dell’ex ministro - Globalist.it,CH,it,2022-03-01,Refugee Routes from Ukraine,Switzerland,30,Basel
Land stellt Unterkunft für Flüchtlinge aus Ukraine bereit - Süddeutsche Zeitung - SZ.de,DE,de,2022-03-01,Local Communities,Germany,24,Appenzell Ausserrhoden
Mädchen aus Ukraine von Tante nach Ladenburg geholt - SWR Aktuell,DE,de,2022-03-01,Children and Human Rights,Germany,17,Basel
"I profughi dall'Ucraina arrivano in Italia: al via il piano di accoglienza, dove vengono alloggiati - Virgilio Notizie",CH,it,2022-03-01,Current Information Refugees,Switzerland,39,Appenzell Innerrhoden
"“Presto quattro milioni di profughi, la crisi più grande” - la Repubblica",CH,it,2022-03-01,Accomodation,Switzerland,24,Baden-Württemberg
Ucraina: Caritas Ungheria sul confine per accogliere i rifugiati. 100 ... - Servizio Informazione Religiosa,CH,it,2022-03-01,Local Communities,Switzerland,33,Thurgau
I migliori articoli su rifugiati e immigrazione 9/2022 ⁄ Open Migration - Open Migration,CH,it,2022-03-01,Accomodation,Switzerland,24,Schaffhausen
In fuga dalla guerra. L'ondata dei profughi ucraini in Veneto - ilgazzettino.it,CH,it,2022-03-01,Local Communities,Switzerland,27,Grisons
Aiuti per l’Ucraina: come sostenere a distanza o in regione le famiglie che arrivano in Friuli Venezia Giulia - Il Messaggero Veneto,CH,it,2022-03-01,Volunteering and Donations,Switzerland,41,Baden-Württemberg
"Caritas Internationalis, Ucraina: si aprano corridoi umanitari per i civili - Vatican News - Italiano",CH,it,2022-03-01,Volunteering and Donations,Switzerland,28,North Rhine-Westphalia
"Guerra in Ucraina, Novara si prepara ad accogliere i rifugiati - NovaraToday",CH,it,2022-03-01,Local Communities,Switzerland,25,Saxony
"Ucraina, Comune di Scisciano organizza una rete di accoglienza per i rifugiati nel nolano - ilmattino.it",CH,it,2022-03-01,Local Communities,Switzerland,35,Lucerne
L'ITALIA ACCOGLIERà GLI ANIMALI DEI RIFUGIATI UCRAINI IN ... - GLI STATI GENERALI,CH,it,2022-03-01,Current Information Refugees,Switzerland,34,Lucerne
I cittadini ucraini potranno viaggiare gratis sui treni diretti in Germania - Il Mitte,CH,it,2022-03-01,Current Information Refugees,Switzerland,27,Baden-Württemberg
"Guerra in Ucraina, Caritas di Vittorio Veneto: ecco come aiutare - TrevisoToday",CH,it,2022-03-01,Volunteering and Donations,Switzerland,26,Schleswig-Holstein
Raccolta di aiuti per l'Ucraina - RSI.ch Informazione,CH,it,2022-03-01,Volunteering and Donations,Switzerland,19,Geneva
