text,alpha2_code,language_code,date,cluster,country,tokens,state
Krieg in der Ukraine: Nancy Faeser will »vorübergehenden Schutz ... - DER SPIEGEL,DE,de,2022-02-24,Current Information War,Germany,24,Hamburg
Flucht aus der Ukraine: Zug und Rückzug - Die Zeit,DE,de,2022-02-24,Volunteering and Donations,Germany,13,Appenzell Ausserrhoden
Bremen bereitet mögliche Aufnahme von Flüchtlingen aus der ... - buten un binnen,DE,de,2022-02-24,Local Communities,Germany,22,Hamburg
Krieg in der Ukraine: Deutschland zur Aufnahme von Flüchtlingen bereit - FAZ - Frankfurter Allgemeine Zeitung,DE,de,2022-02-24,Current Information Refugees,Germany,29,Schaffhausen
"Nothelfer in der Ukraine: ""In zwei bis drei Tagen Engpässe"" - tagesschau.de",DE,de,2022-02-24,Volunteering and Donations,Germany,26,Hesse
"Flüchtlinge an der Grenze zwischen Ukraine und Polen: ""Die Welt muss uns helfen"" - FOCUS Online",DE,de,2022-02-24,Local Communities,Germany,26,Berlin
Folgen der Russland-Ukraine-Krise auf Unternehmen der Region - SWR Aktuell,DE,de,2022-02-24,Sanktions Russia and War Strategy,Germany,19,Saarland
"CDU-Bundestagsabgeordneter Roderich Kiesewetter: ""Von Putin ... - SWR Aktuell",DE,de,2022-02-24,Sanktions Russia and War Strategy,Germany,29,Mecklenburg-Vorpommern
Guerre en Ukraine – Un appel pour l'accueil de réfugiés ukrainiens ... - 24 heures,CH,fr,2022-02-24,Local Communities,Switzerland,26,Obwalden
"Guerre en Ukraine : A la frontière hongroise, les premiers réfugiés fuient les combats - 20 Minutes",CH,fr,2022-02-24,Local Communities,Switzerland,31,Baden-Württemberg
Guerre en Ukraine : L'association Loire-Ukraine-Russie solidaire ... - France 3 Régions,CH,fr,2022-02-24,Sanktions Russia and War Strategy,Switzerland,27,Fribourg
Justin Trudeau annonce de nouvelles sanctions contre la Russie ... - Radio-Canada.ca,CH,fr,2022-02-24,Sanktions Russia and War Strategy,Switzerland,16,Geneva
"Guerre en Ukraine : Martine Aubry veut aider la ville ukrainienne de Kharkiv, jumelée avec Lille - 20 Minutes",CH,fr,2022-02-24,Volunteering and Donations,Switzerland,34,Glarus
Guerre en Ukraine : ces exilés en Bretagne qui s’inquiètent pour leur pays - Le Télégramme,CH,fr,2022-02-24,Current Information Refugees,Switzerland,27,Lucerne
Invasion de l'Ukraine : Les 27 condamnent l'implication de la ... - RTBF,CH,fr,2022-02-24,Current Information War,Switzerland,25,Uri
Guerre en Ukraine : les réactions affluent au Manitoba - Radio-Canada.ca,CH,fr,2022-02-24,Current Information War,Switzerland,17,Berlin
"Elle est russe, il est ukrainien : un couple de commerçants brestois ... - Le Télégramme",CH,fr,2022-02-24,Sanktions Russia and War Strategy,Switzerland,28,Saxony-Anhalt
Une entreprise de covoiturage pour réunir les gens et réduire l ... - Radio-Canada.ca,CH,fr,2022-02-24,Volunteering and Donations,Switzerland,24,Saxony
Ukrainische Bevölkerung: Auf der Flucht | ZEIT ONLINE - Die Zeit,CH,de,2022-02-24,Volunteering and Donations,Switzerland,22,Basel
Autokolonnen auf den Straßen: Menschen fliehen massenhaft aus Kiew - zdf.de,CH,de,2022-02-24,Volunteering and Donations,Switzerland,23,Lower Saxony
"Ukraine-Krieg: Explosionen, Flugteile auf Spielplätzen, Flucht – Bilder aus dem ukrainischen Kriegsgebiet - Handelsblatt",CH,de,2022-02-24,Current Information War,Switzerland,38,Glarus
Ukraine-Krieg: Russland greift an - die Flucht hat begonnen - DER SPIEGEL,CH,de,2022-02-24,Sanktions Russia and War Strategy,Switzerland,22,Schwyz
Menschen aus der Ukraine fliehen bereits nach Ungarn - Ungarn Heute,CH,de,2022-02-24,Current Information Refugees,Switzerland,18,Basel
Krieg: Hunderte Deutsche noch in der Ukraine – „Ich will sie bei mir ... - kreiszeitung.de,CH,de,2022-02-24,Volunteering and Donations,Switzerland,24,North Rhine-Westphalia
Schockierte Reaktionen auf Putins Krieg - Vatican News - Deutsch,CH,de,2022-02-24,Sanktions Russia and War Strategy,Switzerland,17,Grisons
Krieg in der Ukraine schüttelt Börse durch – was Experten den Anlegerinnen und Anlegern raten - RND,CH,de,2022-02-24,Current Information War,Switzerland,31,Hamburg
Ukraine-Krieg: Koblenzer sorgen sich um Verwandte in der Heimat - SWR Aktuell,CH,de,2022-02-24,Children and Human Rights,Switzerland,24,Geneva
Ukraine: Angst vor großem russischem Angriff – Menschen fliehen ... - Stuttgarter Nachrichten,CH,de,2022-02-24,Sanktions Russia and War Strategy,Switzerland,27,Valais
Krieg: Ukrainer aus dem Westen der Pfalz sorgt sich um Verwandte - SWR Aktuell,CH,de,2022-02-24,Children and Human Rights,Switzerland,25,Appenzell Innerrhoden
Gabriele Haselsberger: Wirtschaftsdelegierte über ihre Flucht aus ... - Kleine Zeitung,CH,de,2022-02-24,Volunteering and Donations,Switzerland,24,Bavaria
Ukraine: Kämpfe beenden - Save the Children Deutschland,CH,de,2022-02-24,Current Information War,Switzerland,14,Berlin
"Hilflos, ohne Plan: Menschen in Kiew. Viele flüchten vor den Russen aus der Hauptstadt - Berliner Kurier",CH,de,2022-02-24,Volunteering and Donations,Switzerland,31,Grisons
So verbringen Menschen in Kiew die erste Nacht im Krieg - SWR3,CH,de,2022-02-24,Current Information War,Switzerland,18,Thuringia
"Aufnahmen zeigen lange Staus: Ukrainer versuchen, aus Kiew zu fliehen - n-tv NACHRICHTEN",CH,de,2022-02-24,Volunteering and Donations,Switzerland,29,Fribourg
Russischer Angriff auf die Ukraine: „Imperiales Denken“ - fr.de,CH,de,2022-02-24,Sanktions Russia and War Strategy,Switzerland,19,Berlin
Krieg in der Ukraine: Diese Auswirkungen könnten auf Deutschland zukommen - Nordbayern.de,CH,de,2022-02-24,Volunteering and Donations,Switzerland,23,Grisons
Dem Krieg entkommen: Erste Flüchtlinge aus der Ukraine gelangen ... - TAG24,CH,de,2022-02-24,Local Communities,Switzerland,22,Thurgau
Ukraine-Konflikt: Unser Reporter in Kiew – So erleben Ukrainer den Kriegsbeginn - WAZ News,CH,de,2022-02-24,Current Information War,Switzerland,30,Sankt Gallen
"Opern-Star: ""Freunde in Ukraine fliehen in ihre Keller"" - Heute.at",CH,de,2022-02-24,Volunteering and Donations,Switzerland,20,Basel
Ukraine-Konflikt am Krypto-Markt: Gold-gedeckte Stablecoins ... - BTC-ECHO | Bitcoin & Blockchain seit 2014,CH,de,2022-02-24,Volunteering and Donations,Switzerland,34,Saxony-Anhalt
Krieg zwischen Russland und der Ukraine: BW wegen Putin in Sorge - SWR Aktuell,CH,de,2022-02-24,Sanktions Russia and War Strategy,Switzerland,20,Bavaria
Niedersachsen: Braunschweiger gehen wegen Ukraine-Krieg auf die Straße - News38,CH,de,2022-02-24,Volunteering and Donations,Switzerland,21,Schleswig-Holstein
"Bochum: Mann berichtet von schrecklichen Zuständen in Ukraine – „Man weiß nicht, wie lange diese Hölle andauern wird“ - DER WESTEN",CH,de,2022-02-24,Current Information War,Switzerland,37,Aargau
"Ukrainerin zum Kriegsausbruch: «Putin, sieht so brüderliche Liebe aus?» - watson",CH,de,2022-02-24,Sanktions Russia and War Strategy,Switzerland,28,Saxony-Anhalt
L'Autriche prête à admettre des réfugiés ukrainiens malgré sa ... - EURACTIV France,CH,fr,2022-02-24,Current Information Refugees,Switzerland,29,Sankt Gallen
Guerre en Ukraine : comment l'accueil des réfugiés se prépare en ... - franceinfo,CH,fr,2022-02-24,Local Communities,Switzerland,23,Baden-Württemberg
Lyon : le maire Grégory Doucet se tient prêt à accueillir des réfugiés ... - Lyon Mag,CH,fr,2022-02-24,Accomodation,Switzerland,31,Neuchâtel
Guerre en Ukraine : faut-il s’attendre à une vague de réfugiés en Europe ? - Le Parisien,CH,fr,2022-02-24,Current Information Refugees,Switzerland,27,Neuchâtel
Ukraine : le HCR demande aux pays voisins de laisser ouvertes ... - ONU Info,CH,fr,2022-02-24,Volunteering and Donations,Switzerland,22,Sankt Gallen
Guerre en Ukraine: réactions du monde chrétien – Portail catholique ... - cath.ch,CH,fr,2022-02-24,Statements by the Church,Switzerland,23,Lucerne
Des personnalités de l'UE appellent à la reconnaissance de l ... - EURACTIV France,CH,fr,2022-02-24,Refugee Routes from Ukraine,Switzerland,21,Vaud
Vidéos. Guerre en Ukraine : des embouteillages massifs autour de ... - Sud Ouest,CH,fr,2022-02-24,Current Information War,Switzerland,24,Bern
Ukraine Konflikt aktuell: Stimmen und Reaktionen aus dem Allgäu zu Russlands Angriff - Allgäuer Zeitung,DE,de,2022-02-24,Sanktions Russia and War Strategy,Germany,34,Lower Saxony
Guerre en Ukraine: l’ONU évoque des « crimes de guerre » en ... - Le Desk,CH,fr,2022-02-24,Current Information War,Switzerland,25,Obwalden
Ukraine-Krieg: Wie die Menschen den russischen Angriff empfinden - Neue Zürcher Zeitung - NZZ,CH,de,2022-02-24,Sanktions Russia and War Strategy,Switzerland,27,Hesse
So reagiert die MV-Regierung auf den Krieg in der Ukraine - Nordkurier,DE,de,2022-02-24,Current Information War,Germany,20,Zurich
"Guerra in Ucraina, partiti in migliaia, «I rifugiati saranno un milione» - Corriere della Sera",CH,it,2022-02-24,Local Communities,Switzerland,31,Mecklenburg-Vorpommern
"Ucraina, volontari al confine romeno: ""Ci prepariamo ai rifugiati"" - Dire",CH,it,2022-02-24,Refugee Routes from Ukraine,Switzerland,23,Bremen
Milano accoglierà i rifugiati dall'Ucraina a causa della guerra - MilanoToday.it,CH,it,2022-02-24,Current Information Refugees,Switzerland,23,Uri
Orban ha paura dei rifugiati ucraini e militarizza la frontiera - EuNews,CH,it,2022-02-24,Local Communities,Switzerland,22,Valais
"Emergenza profughi, Ue pronta a sostenere Stati - Europa - Agenzia ANSA",CH,it,2022-02-24,Accomodation,Switzerland,25,Hamburg
"Ucraina: patriarca ordosso Daniel, ""trovare la via del dialogo ... - Servizio Informazione Religiosa",CH,it,2022-02-24,Volunteering and Donations,Switzerland,30,Solothurn
"Polonia: Varsavia, giunto alla stazione centrale il primo treno di ... - Servizio Informazione Religiosa",CH,it,2022-02-24,Refugee Routes from Ukraine,Switzerland,28,Saxony
Ucraina: rifugiato in ambasciata a Kiev il fiorentino designatore degli arbitri - FirenzeToday,CH,it,2022-02-24,Local Communities,Switzerland,27,Vaud
"Ucraina, a Kiev le persone si rifugiano nelle stazioni della metro – Video - Il Fatto Quotidiano",CH,it,2022-02-24,Current Information Refugees,Switzerland,27,Lower Saxony
Conflitto in Ucraina – La richiesta di asilo non può essere ritenuta ... - Melting Pot,CH,it,2022-02-24,Local Communities,Switzerland,25,Basel
"Ungheria, Orban schiera truppe ai confini con l'Ucraina - La Stampa",CH,it,2022-02-24,Refugee Routes from Ukraine,Switzerland,23,Schwyz
"Bollette, gas, grano: le conseguenze della guerra in Ucraina per l’Italia - Corriere della Sera",CH,it,2022-02-24,Current Information Refugees,Switzerland,29,Lower Saxony
"Ucraina: Tavolo asilo e immigrazione, “si accolgano i profughi della ... - Asgi",CH,it,2022-02-24,Local Communities,Switzerland,28,Lucerne
"Ucraina Russia, le notizie di giovedì 24 febbraio: la guerra è iniziata. I russi alle porte di Kiev - Corriere della Sera",CH,it,2022-02-24,Sanktions Russia and War Strategy,Switzerland,40,Obwalden
Chi sono i 'nazisti ucraini' che Putin dice di voler eliminare - EuropaToday,CH,it,2022-02-24,Sanktions Russia and War Strategy,Switzerland,22,Basel
"Invasione russa dell'Ucraina, a novembre 2021 le prime rivelazioni su ""Repubblica"" - la Repubblica",CH,it,2022-02-24,Sanktions Russia and War Strategy,Switzerland,33,Neuchâtel
La guerra in Ucraina in diretta video - Corriere TV,CH,it,2022-02-24,Current Information War,Switzerland,14,Lower Saxony
Ucraina: le donne chiamate ad arruolarsi - Donna Moderna,CH,it,2022-02-24,Children and Human Rights,Switzerland,18,Valais
Il Colosseo si illumina con i colori dell'Ucraina: il sindaco condanna l ... - La Voce di New York,CH,it,2022-02-24,Volunteering and Donations,Switzerland,31,Lower Saxony
"Ucraina e Russia in guerra, i bimbi di Kiev a scuola con il gruppo sanguigno sulla manica. I genitori: abbiamo - ilmattino.it",CH,it,2022-02-24,Children and Human Rights,Switzerland,41,Neuchâtel
In Moldavia i primi 4.000 profughi La Polonia mobilita 120 ospedali - Il Manifesto,CH,it,2022-02-24,Local Communities,Switzerland,28,Hamburg
"Ebrei in Ucraina: una presenza secolare, ancora oggi preoccupata ... - Mosaico-cem.it",CH,it,2022-02-24,Statements by the Church,Switzerland,28,Basel
"Ucraina, volontari al confine con la Romania: “Ci prepariamo ai ... - Emergency Live IT",CH,it,2022-02-24,Refugee Routes from Ukraine,Switzerland,23,Fribourg
"Laura Pausini: «Se Marco non mi avesse tradita, non avrei vinto Sanremo» - Sette del Corriere della Sera",CH,it,2022-02-24,Current Information Refugees,Switzerland,33,Glarus
"Vittorio Matteucci chi è? Età, vita privata, moglie dell'attore - LA NOTIZIA",CH,it,2022-02-24,Current Information Refugees,Switzerland,26,Zurich
Guerre en Ukraine – Un appel pour l'accueil de réfugiés ukrainiens ... - Tribune de Genève,CH,fr,2022-02-24,Local Communities,Switzerland,27,Schaffhausen
Le Québec prêt à accueillir des réfugiés ukrainiens - Le Devoir,CH,fr,2022-02-24,Local Communities,Switzerland,22,Rhineland-Palatinate
Première journée de guerre en Ukraine – DW – 24/02/2022 - DW (Français),CH,fr,2022-02-24,Current Information War,Switzerland,25,Ticino
Le testimonianze dall’Ucraina nelle prime ore di guerra: «Dobbiamo ospitare 3mila bambini» - Corriere della Sera,CH,it,2022-02-24,Children and Human Rights,Switzerland,35,North Rhine-Westphalia
"Guerra Ucraina-Russia, le possibili conseguenze per l'Italia - Sky Tg24",CH,it,2022-02-24,Current Information Refugees,Switzerland,22,Valais
La Croce Rossa russa lancia missione umanitaria per sfollati dal ... - Emergency Live IT,CH,it,2022-02-24,Sanktions Russia and War Strategy,Switzerland,25,Valais
"Ucraina, il Massimo di Palermo illuminato coi colori della pace - Corriere del Mezzogiorno",CH,it,2022-02-24,Volunteering and Donations,Switzerland,26,Thurgau
"Invasione russa, la comunità ucraina in Italia sotto choc: ""Torniamo in patria per combattere&quo - Gazzetta del Sud",CH,it,2022-02-24,Sanktions Russia and War Strategy,Switzerland,38,Lower Saxony
"Dopo l'invasione, sotto il cielo terribile di Kiev. Reportage dalla ... - Il Manifesto",CH,it,2022-02-24,Current Information War,Switzerland,25,Aargau
Ukraine Krieg: Russland nimmt Katastrophen-Ort Tschernobyl ein - Nau.ch,CH,de,2022-02-24,Sanktions Russia and War Strategy,Switzerland,25,Basel
Krieg in der Ukraine: Mehr als 100.000 auf der Flucht - tagesschau.de,CH,de,2022-02-25,Current Information War,Switzerland,22,Grisons
Krieg in der Ukraine - Die grosse Flucht nach Westen – die Übersicht - SRF – Schweizer Radio und Fernsehen,CH,de,2022-02-25,Current Information War,Switzerland,28,Aargau
Ukraine: Deutschland bereitet sich auf Flüchtlinge vor - DW (Deutsch),CH,de,2022-02-25,Current Information Refugees,Switzerland,20,Fribourg
Todesangst in Kiew: Offene Arme bei den Nachbarländern - zdf.de,CH,de,2022-02-25,Current Information War,Switzerland,22,Uri
Solidarität mit der Ukraine heißt auch: Fluchtwege offen halten! - Pro Asyl,CH,de,2022-02-25,Volunteering and Donations,Switzerland,21,Zug
"Flucht aus der Ukraine: ""Vielleicht helfen uns gute Menschen"" - VIENNA.AT - Alles über Wien",CH,de,2022-02-25,Volunteering and Donations,Switzerland,25,Schleswig-Holstein
Flucht aus der Ukraine: Ein Dachdecker aus SH berichtet - NDR.de,CH,de,2022-02-25,Volunteering and Donations,Switzerland,19,Basel
"Flucht aus der Ukraine: ""Wir wollen weiter, wissen aber nicht wohin"" - n-tv NACHRICHTEN",CH,de,2022-02-25,Volunteering and Donations,Switzerland,27,Saxony
Russland-Ukraine-Krieg: BW bereitet sich auf Flüchtlinge vor - SWR Aktuell,CH,de,2022-02-25,Sanktions Russia and War Strategy,Switzerland,23,Aargau
Krieg in der Ukraine: Viele Ukrainer werden laut Experten flüchten - watson - Politik,CH,de,2022-02-25,Volunteering and Donations,Switzerland,23,Nidwalden
Ukraine-Krieg: Mehr als 100.000 Menschen fliehen - Deutsches ... - Merkur.de,CH,de,2022-02-25,Volunteering and Donations,Switzerland,24,Hesse
So bereitet sich Deutschland auf Geflüchtete aus der Ukraine vor - fr.de,CH,de,2022-02-25,Current Information Refugees,Switzerland,18,Brandenburg
Wichtige Infos zu Einreise und Verbleib in Deutschland für Ukrainer ... - Pro Asyl,CH,de,2022-02-25,Volunteering and Donations,Switzerland,22,Glarus
Kriegsflüchtlinge aus der Ukraine: Unterkunft im Ankunftszentrum - Berlin.de,CH,de,2022-02-25,Local Communities,Switzerland,24,Neuchâtel
"Fotos aus dem Russland-Ukraine-Krieg: Es flieht, wer darf - DER ... - DER SPIEGEL",CH,de,2022-02-25,Sanktions Russia and War Strategy,Switzerland,26,Valais
"Musiker zum Ukraine-Krieg: Petrenko: ""Ein Messer in den Rücken ... - BR-Klassik",CH,de,2022-02-25,Volunteering and Donations,Switzerland,25,Thuringia
Landkreis bereitet sich auf Flüchtlinge aus der Ukraine vor - Donau-Ries-Aktuell,CH,de,2022-02-25,Local Communities,Switzerland,24,Thurgau
Russland-Ukraine-Ticker vom Freitag: Nato kündigt Truppen-Verstärkung in Osteuropa an - MDR,CH,de,2022-02-25,Current Information War,Switzerland,32,Fribourg
Ukraine-Krieg: Russlands Invasion - Kann der Krieg nach Deutschland kommen? - RND,CH,de,2022-02-25,Sanktions Russia and War Strategy,Switzerland,20,Fribourg
Ukrainer auf der Flucht nach Bielefeld - Stadt startet Vorbereitungen - Neue Westfälische,CH,de,2022-02-25,Volunteering and Donations,Switzerland,26,Schleswig-Holstein
"Ukraine-Krieg: Was Anleger jetzt tun können, was Fonds-Legende ... - Merkur.de",CH,de,2022-02-25,Volunteering and Donations,Switzerland,24,Baden-Württemberg
Krieg in der Ukraine: Vater verabschiedet sich in emotionalem Video ... - hna.de,CH,de,2022-02-25,Children and Human Rights,Switzerland,22,Obwalden
Landkreis Dachau bereitet sich auf Ukraine-Flüchtlinge vor - Merkur.de,CH,de,2022-02-25,Local Communities,Switzerland,22,Basel
Krieg in Ukraine: Politik in RLP bereitet sich auf Flüchtlinge vor - SWR Aktuell,CH,de,2022-02-25,Local Communities,Switzerland,25,North Rhine-Westphalia
"Klitschko-Brüder erklären sich bereit, selbst in den Krieg zu ziehen ... - Merkur.de",CH,de,2022-02-25,Current Information War,Switzerland,28,Mecklenburg-Vorpommern
Ukraine-Krieg: Frau aus Heilbronn bangt um Familie in Ukraine - SWR Aktuell,CH,de,2022-02-25,Children and Human Rights,Switzerland,22,Brandenburg
MV erwartet erste Flüchtlinge aus der Ukraine - NDR.de,CH,de,2022-02-25,Local Communities,Switzerland,17,Rhineland-Palatinate
"Ukrainische Flüchtlinge: Geschockt vom Krieg ""im Herzen Europas"" - DW (Deutsch)",CH,de,2022-02-25,Local Communities,Switzerland,29,Ticino
Krieg in der Ukraine: Flüchtlinge erster Klasse | nd-aktuell.de - nd - Journalismus von links,CH,de,2022-02-25,Local Communities,Switzerland,28,Schleswig-Holstein
Flucht vor Ukraine-Krieg: Heilbronn sieht sich gut vorbereitet - SWR Aktuell,CH,de,2022-02-25,Current Information War,Switzerland,22,Zurich
Die ersten Flüchtlinge aus der Ukraine sind schon in Berlin - B.Z. ... - B.Z. – Die Stimme Berlins,CH,de,2022-02-25,Current Information Refugees,Switzerland,30,Hamburg
Fastnacht trotz Ukraine-Krieg? Kretschmann nimmt Stellung - SWR Aktuell,CH,de,2022-02-25,Current Information War,Switzerland,21,Ticino
"Ukraine : cinq millions d'Ukrainiens pourraient fuir leur pays, selon ... - ONU Info",CH,fr,2022-02-25,Volunteering and Donations,Switzerland,26,Vaud
"Réfugiés ukrainiens : ""une immigration de qualité dont on pourra ... - Marianne",CH,fr,2022-02-25,Local Communities,Switzerland,22,Geneva
Guerre en Ukraine : La solidarité des Polonais envers les réfugiés ukrainiens - 20 Minutes,CH,fr,2022-02-25,Current Information Refugees,Switzerland,29,Aargau
"«C'est pas des syriens », les ukrainiens « on peut en tirer profit » : surenchère réac à la télé - http://www.revolutionpermanente.fr/Section-Politique",CH,fr,2022-02-25,Volunteering and Donations,Switzerland,48,Lucerne
Ukraine : envie d’apporter votre aide à la population ? Voici comment faire. - POSITIVR,CH,fr,2022-02-25,Volunteering and Donations,Switzerland,25,Hamburg
François: une prophétie de la non-violence est nécessaire - Vatican News - Français,CH,fr,2022-02-25,Volunteering and Donations,Switzerland,20,Bremen
Ukraine-Krieg: Viele Flüchtlinge in Polen - UN rechnet mit vier Millionen Migranten - RND,DE,de,2022-02-25,Current Information Refugees,Germany,29,Appenzell Innerrhoden
Ukraine-Krieg: Flüchtlinge - UN erwarten bis zu vier Millionen Migranten - RND,DE,de,2022-02-25,Local Communities,Germany,24,Vaud
Ukraine-Konflikt: Panzer nähern sich aus Belarus– Was will ... - fr.de,DE,de,2022-02-25,Current Information War,Germany,23,Zug
Angriff auf die Ukraine: CDU fordert konkrete Vorbereitungen zur ... - WELT,DE,de,2022-02-25,Current Information War,Germany,25,Schleswig-Holstein
"Ukraine-Russland-Krieg: ""Putin ist ein Terrorist!"" - WDR Nachrichten",DE,de,2022-02-25,Sanktions Russia and War Strategy,Germany,20,Basel
Bezirksbürgermeister Uwe Brockhausen: „Trauer und Entsetzen ... - Berlin.de,DE,de,2022-02-25,Volunteering and Donations,Germany,24,Appenzell Ausserrhoden
"Politologe zu Ukraine-Krieg: ""Zeit, Einfluss zu nehmen, ist abgelaufen"" - zdf.de",DE,de,2022-02-25,Current Information War,Germany,28,Saxony-Anhalt
Ankerzentrum bei Geldersheim bereitet sich auf Flüchtlinge aus der ... - Main-Post,DE,de,2022-02-25,Accomodation,Germany,24,Saxony
"30 Jahre nach Unabhängigkeit: ""Bosnien kann kein Zuhause sein"" - Kleine Zeitung",DE,de,2022-02-25,Volunteering and Donations,Germany,25,Hesse
Florenz: Friedenstreffen in diesem Moment besonders wichtig - Vatican News - Deutsch,DE,de,2022-02-25,Current Information Refugees,Germany,18,Neuchâtel
"EU will Flüchtlinge aus Ukraine aufnehmen, hofft aber, dass es ... - t-online",DE,de,2022-02-25,Current Information Refugees,Germany,23,Thuringia
"Überfüllte Züge, Stau an der Grenze: UN erwarten bis zu vier ... - Tagesspiegel",DE,de,2022-02-25,Refugee Routes from Ukraine,Germany,28,Saxony
"Ukraine: ""Beten und demonstrieren reicht nicht"" - Freising - SZ.de - Süddeutsche Zeitung - SZ.de",DE,de,2022-02-25,Volunteering and Donations,Germany,30,Rhineland-Palatinate
"Erst kamen die Deutschen, jetzt die Russen (nd-aktuell.de) - nd - Journalismus von links",DE,de,2022-02-25,Volunteering and Donations,Germany,26,Ticino
L'OEIL DU TEMOIN DE CE VENDREDI - seneplus.com,CH,fr,2022-02-25,Current Information Refugees,Switzerland,19,Bern
"F1 et politique : Silence, on roule ! - Autohebdo",CH,fr,2022-02-25,Volunteering and Donations,Switzerland,16,Ticino
La Suisse adopte une ligne plus dure envers la Russie - RTS.ch,CH,fr,2022-02-25,Sanktions Russia and War Strategy,Switzerland,18,Zurich
Invasion en Ukraine: des demandes d'asile d'Ukrainiens déjà ... - Sudinfo.be,CH,fr,2022-02-25,Local Communities,Switzerland,24,Berlin
Les collectivités françaises se mobilisent pour l'Ukraine - La Gazette des communes,CH,fr,2022-02-25,Refugee Routes from Ukraine,Switzerland,21,Basel
"Guerre en Ukraine | Le Canada doit lever les visas, demandent les ... - La Presse",CH,fr,2022-02-25,Local Communities,Switzerland,21,Schaffhausen
L'armée russe poursuit son offensive en direction de Kiev - RTS.ch,CH,fr,2022-02-25,Sanktions Russia and War Strategy,Switzerland,16,Saxony
"Guerre en Ukraine : fuir ou se battre, le dilemme des Ukrainiens à la ... - Le Monde",CH,fr,2022-02-25,Current Information War,Switzerland,27,Glarus
Guerre en Ukraine: quatre impacts probables pour les Belges - Le Vif,CH,fr,2022-02-25,Refugee Routes from Ukraine,Switzerland,18,Bremen
Lyon. Accueil des réfugiés ukrainiens : « La Ville de Lyon se tient ... - Le Progrès,CH,fr,2022-02-25,Current Information Refugees,Switzerland,29,Basel
"Sanctions, suspension des visas....les armes européennes pour ... - Le Temps",CH,fr,2022-02-25,Refugee Routes from Ukraine,Switzerland,18,Rhineland-Palatinate
Ukraine : les équipes MSF préoccupées par les conséquences du ... - Médecins Sans Frontières Belgique,CH,fr,2022-02-25,Volunteering and Donations,Switzerland,28,Bremen
"ENTRETIEN. Guerre en Ukraine : l'inquiétude de Larysa, née à Kiev et installée en Ariège - LaDepeche.fr",CH,fr,2022-02-25,Current Information War,Switzerland,36,Thuringia
Guerre en Ukraine - Les avocats du barreau d'Epinal se mobilisent ... - Epinal Infos,CH,fr,2022-02-25,Current Information War,Switzerland,26,Uri
"Mitia Fedotenko : « Russe d'origine ukrainienne, je suis coupé en ... - Le Club de Mediapart",CH,fr,2022-02-25,Sanktions Russia and War Strategy,Switzerland,31,Schleswig-Holstein
"En Pologne, l'arrivée des réfugiés ukrainiens fuyant la guerre - Le Temps",CH,fr,2022-02-25,Current Information Refugees,Switzerland,28,Glarus
Réfugiés ukrainiens : « Il ne faut pas refaire les erreurs de la crise syrienne » - ELLE France,CH,fr,2022-02-25,Local Communities,Switzerland,31,Schwyz
Charente-Maritime : une association de Sainte-Soulle lance un ... - Sud Ouest,CH,fr,2022-02-25,Migration Apart from Ukraine,Switzerland,21,Saxony
Guerre en Ukraine : le maire de Sarrebruck prêt à accueillir des ... - Radio Mélodie,CH,fr,2022-02-25,Current Information War,Switzerland,28,Lucerne
Guerre en Ukraine. Besançon : le boulanger Stéphane Ravacley ... - Est Républicain,CH,fr,2022-02-25,Current Information War,Switzerland,27,Schwyz
Guerre en Ukraine : la Mairie de Cannes lance une collecte… - Mairie de Cannes,CH,fr,2022-02-25,Current Information War,Switzerland,21,Grisons
"« On ne dort plus, on ne mange plus » : les Ukrainiens de France, entre angoisse et envie de se battre - L'Obs",CH,fr,2022-02-25,Volunteering and Donations,Switzerland,33,Vaud
Guerre en Ukraine : des milliers d'Ukrainiens fuient les combats - franceinfo,CH,fr,2022-02-25,Current Information War,Switzerland,23,Bremen
Guerre en Ukraine: quelles conséquences pour les pays d'Europe ... - Le Figaro,CH,fr,2022-02-25,Refugee Routes from Ukraine,Switzerland,22,Vaud
"« Si l’Europe n’arrête pas Poutine en Ukraine, il arrivera aux portes de Berlin ou de Paris », prédit l’opposante biélorusse, Svetlana Tikhanovskaïa - Public Senat",CH,fr,2022-02-25,Sanktions Russia and War Strategy,Switzerland,57,Bavaria
