text,alpha2_code,language_code,date,cluster,country,tokens,state
Ucraina: il Consiglio introduce all'unanimità la protezione ... - Consilium.europa.eu,CH,it,2022-03-04,Volunteering and Donations,Switzerland,25,Basel
Il Consiglio federale propone lo status S per i profughi ucraini - laRegione,CH,it,2022-03-04,Local Communities,Switzerland,24,Hesse
"Ucraina, ""Le bombe non distinguono tra europei e africani"": continuano le discriminazionii al confine in base… - la Repubblica",CH,it,2022-03-04,Current Information Refugees,Switzerland,37,Saxony
Guerra in Ucraina: le iniziative in aiuto dei bambini e come sostenerle - Vanity Fair Italia,CH,it,2022-03-04,Children and Human Rights,Switzerland,26,Hamburg
Emergenza Ucraina: come aiutare la popolazione colpita dalla guerra - DOVE Viaggi,CH,it,2022-03-04,Volunteering and Donations,Switzerland,25,Bavaria
Ucraina Russia: le news sulla guerra di oggi - La Stampa,CH,it,2022-03-04,Sanktions Russia and War Strategy,Switzerland,15,Sankt Gallen
Come ospitare profughi e bambini ucraini - Money.it,CH,it,2022-03-04,Children and Human Rights,Switzerland,17,Bavaria
"Ucraina, ecco dove portare cibo, farmaci e vestiti. Come offrire ospitalità. Tutti gli indirizzi - Repubblica Roma",CH,it,2022-03-04,Volunteering and Donations,Switzerland,37,Zug
"Ucraina, l’appello anche in Sicilia: “Cerchiamo famiglie per accogliere i profughi” - Liveunict | Magazine sull'Università di Catania",CH,it,2022-03-04,Local Communities,Switzerland,44,Brandenburg
Come fare bene guerra alla guerra di Putin all'Ucraina. Ipotesi e ... - Start Magazine,CH,it,2022-03-04,Sanktions Russia and War Strategy,Switzerland,22,Bern
"Ucraina, da Cimea corso di formazione per favorire l’integrazione di studenti e prof - Il Sole 24 ORE",CH,it,2022-03-04,Children and Human Rights,Switzerland,32,Appenzell Innerrhoden
Pubblicato il n. 1/2022 della Rivista Diritto Immigrazione e ... - Asgi,CH,it,2022-03-04,Problems Refugee Management,Switzerland,26,Rhineland-Palatinate
"Bonus asilo nido, cambiano modalità di richiesta: le indicazioni - Liveunict | Magazine sull'Università di Catania",CH,it,2022-03-04,Problems Refugee Management,Switzerland,31,North Rhine-Westphalia
"Ucraina, la scuola italiana si prepara ad accogliere gli studenti. Subito 1 milione agli istituti - Il Sole 24 ORE",CH,it,2022-03-04,Children and Human Rights,Switzerland,38,Rhineland-Palatinate
Nel primo week end di marzo in Abruzzo l'Arrampicata Sportiva ... - Federazione Arrampicata Sportiva Italiana,CH,it,2022-03-04,Volunteering and Donations,Switzerland,31,Brandenburg
Mamma ucraina con tre figli fugge dalla guerra e viene ospitata in Sicilia. Biondi: “Non vedo l’ora di abbracciarli” - NewSicilia,CH,it,2022-03-04,Children and Human Rights,Switzerland,45,Hamburg
La leghista Ceccardi dice che bisogna controllare che dall'Ucraina ... - Fanpage.it,CH,it,2022-03-04,Volunteering and Donations,Switzerland,26,Saxony
"Ucraina-Russia, le notizie del 4 marzo sulla guerra - Corriere della Sera",CH,it,2022-03-04,Sanktions Russia and War Strategy,Switzerland,22,Schleswig-Holstein
"ODESSA, PERLA UCRAINA NEL MIRINO RUSSO - Limes",CH,it,2022-03-04,Volunteering and Donations,Switzerland,20,Grisons
Guerra in Ucraina: come offrire ospitalità ai rifugiati - Vanity Fair Italia,CH,it,2022-03-04,Local Communities,Switzerland,21,Aargau
"Covid, ministero della Salute: test ai rifugiati dell’Ucraina entro 48 ore dall'ingresso - Sky Tg24",CH,it,2022-03-04,Local Communities,Switzerland,34,Aargau
"Ucraina, profughi in Italia: tamponi entro 48 ore dall’ingresso e vaccini - Il Sole 24 ORE",CH,it,2022-03-04,Local Communities,Switzerland,33,Saxony
Dei primi 10mila profughi ucraini: molti sono ospitati a Milano - MilanoToday.it,CH,it,2022-03-04,Local Communities,Switzerland,28,Glarus
A Ostiense il capolinea di un corridoio umanitario lungo 2.000 chilometri - RomaToday,CH,it,2022-03-04,Accomodation,Switzerland,30,Baden-Württemberg
Cosa fare se si ospitano persone ucraine in casa - VeneziaToday,CH,it,2022-03-04,Volunteering and Donations,Switzerland,18,Lower Saxony
Il mondo della moda a sostegno dell'Ucraina - Vanity Fair Italia,CH,it,2022-03-04,Volunteering and Donations,Switzerland,17,Zurich
"Ucraina: aiutiamoli, la mobilitazione di Sant'Egidio e della Coop - Famiglia Cristiana",CH,it,2022-03-04,Volunteering and Donations,Switzerland,27,Bavaria
"Ucraina, Mila Kunis e il marito donano 3 milioni di dollari per i rifugiati - Corriere TV",CH,it,2022-03-04,Local Communities,Switzerland,30,Uri
L'AS Roma a sostegno dei bambini ucraini con UNHCR - AS Roma,CH,it,2022-03-04,Children and Human Rights,Switzerland,22,Grisons
"Guerra in Ucraina, l'appello da Vicenza: ""Il cibo e i medicinali non arrivano nelle città assediate"" - VicenzaToday",CH,it,2022-03-04,Volunteering and Donations,Switzerland,35,Valais
Il treno della speranza per i rifugiati dell'Ucraina è diretto a Varsavia ... - La Stampa,CH,it,2022-03-04,Current Information Refugees,Switzerland,28,Sankt Gallen
"Guerra in Ucraina, la campagna su Airbnb: prenotazioni di massa a ... - Open",CH,it,2022-03-04,Current Information Refugees,Switzerland,22,Bavaria
"L’accoglienza di chi scappa dall’Ucraina, ecco la sfida della Croce Rossa Italiana - In Terris",CH,it,2022-03-04,Current Information Refugees,Switzerland,31,Saxony
"Ucraina, l'impegno della moda: Giorgio Armani dona mezzo milione ... - Stile e Trend Fanpage",CH,it,2022-03-04,Volunteering and Donations,Switzerland,30,North Rhine-Westphalia
"Ucraina, La fuga di Dima e Zoya: «Siamo diventati profughi in una notte» - Vanity Fair Italia",CH,it,2022-03-04,Local Communities,Switzerland,32,Appenzell Ausserrhoden
"Profughi ucraini, stabilito il protocollo di accoglienza domestica: sarà coordinato dalla Polizia Locale - BolognaToday",CH,it,2022-03-04,Volunteering and Donations,Switzerland,33,Fribourg
Ucraina: partiti i primi sei camion di aiuti - UNICEF Italia,CH,it,2022-03-04,Volunteering and Donations,Switzerland,20,Vaud
Le cooperative sociali pronte ad accogliere i profughi ucraini - ParmaToday,CH,it,2022-03-04,Local Communities,Switzerland,23,Bremen
Le foto di venerdì dall’Ucraina - Il Post,CH,it,2022-03-04,Current Information War,Switzerland,14,Uri
"La città di Troia pronta ad accogliere decine di ucraini: ""Abbiamo il dovere di farlo"". In arrivo donne, bambini e anziani - l'Immediato",CH,it,2022-03-04,Volunteering and Donations,Switzerland,46,Berlin
Famiglia ucraina in fuga dalla guerra raggiunge Sanremo in treno. Il ... - Riviera Time,CH,it,2022-03-04,Current Information Refugees,Switzerland,27,Schwyz
Gli ucraini nel Vicentino: «Raccogliamo cibo e vestiti. Disposti a tutto ... - Voce Dei Berici,CH,it,2022-03-04,Volunteering and Donations,Switzerland,36,Aargau
KAZAKISTAN Guerra in Ucraina: i kazaki si offrono per mediazione ... - AsiaNews,CH,it,2022-03-04,Current Information War,Switzerland,26,Hamburg
I Testimoni di Geova soccorrono i loro compagni di fede dell'Ucraina - Periodico Daily - Notizie,CH,it,2022-03-04,Statements by the Church,Switzerland,31,Saxony
Cosa succede se la Russia prende Kiev - Money.it,CH,it,2022-03-04,Sanktions Russia and War Strategy,Switzerland,13,Nidwalden
"Etwa 1,4 Millionen Menschen: Zahl der Kriegsflüchtlinge steigt ... - tagesschau.de",DE,de,2022-03-05,Accomodation,Germany,28,Appenzell Innerrhoden
Zehn Millionen Ukraine-Flüchtlinge erwartet: Schaffen wir das? - WDR Nachrichten,DE,de,2022-03-05,Local Communities,Germany,25,Lower Saxony
Evakuierungsaktion aus der Ukraine für afrikanische Studierende - DW (Deutsch),DE,de,2022-03-05,Children and Human Rights,Germany,22,Jura
"Millionen Menschen auf der Flucht, die Aktivierung der ... - Aktuelle Sozialpolitik",DE,de,2022-03-05,Problems Refugee Management,Germany,22,Hesse
40 ukrainische Flüchtlinge auf den Balearen angekommen - Mallorca Magazin,DE,de,2022-03-05,Local Communities,Germany,22,Solothurn
Pressestimmen zum Krieg: „Putin erntet nur Hass und verbrannte Erde“ - FOCUS Online,DE,de,2022-03-05,Sanktions Russia and War Strategy,Germany,27,Grisons
Flüchtlingshilfe: Osterburger Gymnasiasten packen an - MDR,DE,de,2022-03-05,Accomodation,Germany,22,Lucerne
Online-Angebote sollen Ukraine-Hilfe koordinieren und informieren - Bernau LIVE,DE,de,2022-03-05,Volunteering and Donations,Germany,19,Thuringia
Warum Putin uns vollkommen richtig eingeschätzt hat | Cicero Online - Cicero Online,DE,de,2022-03-05,Sanktions Russia and War Strategy,Germany,21,Uri
US-Republikaner und der Krieg: Wie die Trumpisten Stimmung für Putin machen - zdf.de,DE,de,2022-03-05,Sanktions Russia and War Strategy,Germany,25,Saxony-Anhalt
Magdeburger Hoteliers helfen Flüchtlingen aus der Ukraine - Volksstimme,DE,de,2022-03-05,Local Communities,Germany,18,Schaffhausen
Nazis in der Ukraine? – Nein! Unmöglich! - WELTEXPRESS - Weltexpress,DE,de,2022-03-05,Refugee Routes from Ukraine,Germany,23,Basel
Bereits mehr Flüchtlinge aus der Ukraine als aus Syrien oder Jugoslawien angekommen - KURIER,DE,de,2022-03-05,Local Communities,Germany,27,Lower Saxony
"Solidarität für die Ukraine – Eine Geschichte, zu schön, um wahr zu ... - Tages-Anzeiger",DE,de,2022-03-05,Volunteering and Donations,Germany,24,Obwalden
Krieg in der Ukraine: ++ Russische Truppen sollen sich AKW nähern ... - tagesschau.de,DE,de,2022-03-05,Sanktions Russia and War Strategy,Germany,25,Schaffhausen
Erste ukrainische Flüchtlinge im Wartburgkreis angekommen ... - Thüringer Allgemeine,DE,de,2022-03-05,Local Communities,Germany,27,Thurgau
Ukrainekonflikt: Kreis Wesel gibt Informationen zu Hilfsmöglichkeiten - Lokalklick.eu - Online-Zeitung Rhein-Ruhr,DE,de,2022-03-05,Volunteering and Donations,Germany,37,Uri
So war die Ukraine-«Arena» - Luzerner Zeitung,DE,de,2022-03-05,Current Information War,Germany,13,Saxony
Ein Bett in Berlin: Wie Unternehmer und Privatpersonen den ... - DER SPIEGEL,DE,de,2022-03-05,Volunteering and Donations,Germany,20,Bern
Tausende Flüchtlinge aus der Ukraine in Bayern angekommen - BR24,DE,de,2022-03-05,Current Information Refugees,Germany,18,Mecklenburg-Vorpommern
Ukrainische Flüchtlinge in Elchingen und Ulm - SWR Aktuell,DE,de,2022-03-05,Local Communities,Germany,21,Lower Saxony
Hilfsangebote für Flüchtlinge aus der Ukraine ⋆ Leipziger Zeitung - Leipziger Internet-Zeitung,DE,de,2022-03-05,Local Communities,Germany,32,Vaud
Ukraine-Krieg: Wuppertaler Helfer retten Flüchtlinge aus Krisengebiet - Westdeutsche Zeitung,DE,de,2022-03-05,Local Communities,Germany,30,Schleswig-Holstein
100 Ukraine-Flüchtlinge auf dem Weg nach Schaumburg: So kann ... - SZ/LZ,DE,de,2022-03-05,Local Communities,Germany,23,Basel
Ukraine-Krieg: Im Kreis Kassel registrierten sich am Freitag 102 ... - hna.de,DE,de,2022-03-05,Current Information War,Germany,24,Bremen
Flucht aus der Ukraine: Fast 800.000 Menschen in Polen angekommen - FAZ - Frankfurter Allgemeine Zeitung,DE,de,2022-03-05,Volunteering and Donations,Germany,29,Bavaria
"""Die scheinen uns ähnlich"": Sind Ukraine-Berichte rassistisch? - BR24",DE,de,2022-03-05,Current Information Refugees,Germany,21,Basel
Live-Video: Viele Ukraine-Flüchtlinge in Dortmund? Die Lage am ... - Ruhr Nachrichten,DE,de,2022-03-05,Current Information Refugees,Germany,25,Saarland
Krieg in der Ukraine: Am Bahnhof von Lwiw warten Flüchtlinge und freiwillige Kämpfer auf Weiterreise - RND,DE,de,2022-03-05,Local Communities,Germany,36,Solothurn
Wegen Ukraine-Krieg flüchten auch Russen aus ihrer Heimat - FOCUS Online,DE,de,2022-03-05,Sanktions Russia and War Strategy,Germany,19,Lucerne
Erste Ukraine-Flüchtlinge sind da: Familie Gaisonoks Flucht in die ... - BLICK,DE,de,2022-03-05,Local Communities,Germany,24,Thurgau
Krieg in der Ukraine: Dortmunder organisiert privat Wohnungen für ... - t-online,DE,de,2022-03-05,Volunteering and Donations,Germany,19,Geneva
"""Lebst du noch?"" Roma organisieren Hilfe für die Ukraine - DW (Deutsch)",DE,de,2022-03-05,Children and Human Rights,Germany,19,Schaffhausen
Christoph Kulik aus Salzgitter koordiniert Hilfe für Ukrainer - Braunschweiger Zeitung,DE,de,2022-03-05,Volunteering and Donations,Germany,23,Sankt Gallen
Bad Lippspringe und Schlangen bereiten sich auf die Ankunft von Flüchtlingen aus der Ukraine vor - Westfalen-Blatt,DE,de,2022-03-05,Local Communities,Germany,32,Appenzell Ausserrhoden
Ukraine-Krieg: „Wir müssen Oma retten“ – Freunde aus Northeim ... - hna.de,DE,de,2022-03-05,Volunteering and Donations,Germany,25,Jura
„Mutter weckte mich und sagte: Es ist Krieg“ - ORF,DE,de,2022-03-05,Volunteering and Donations,Germany,18,Baden-Württemberg
Kundgebung gegen den Ukraine-Krieg in Aarau - Aargauer Zeitung,CH,de,2022-03-05,Volunteering and Donations,Switzerland,18,Lucerne
Lebensrettende Flucht aus der Ukraine: Christliche Einrichtungen ... - Sonntagsblatt,CH,de,2022-03-05,Statements by the Church,Switzerland,22,North Rhine-Westphalia
"Solidarität für die Ukraine – Eine Geschichte, zu schön, um wahr zu ... - Basler Zeitung",CH,de,2022-03-05,Volunteering and Donations,Switzerland,23,Geneva
Ein Ukrainer berichtet – Terror und Korruption seit vielen Jahren - Nordkurier,CH,de,2022-03-05,Current Information War,Switzerland,17,Saarland
Près de 300 réfugiés ukrainiens accueillis dans une halte humanitaire près de la porte de la Chapelle - Le Parisien,CH,fr,2022-03-05,Local Communities,Switzerland,34,Lucerne
Les Marocains d'Ukraine peuvent-ils bénéficier du droit d'asile dans ... - Yabiladi,CH,fr,2022-03-05,Local Communities,Switzerland,26,Schaffhausen
"Une zone d'exclusion aérienne ferait des pays des cobelligérants, prévient Poutine - RTS.ch",CH,fr,2022-03-05,Sanktions Russia and War Strategy,Switzerland,26,Mecklenburg-Vorpommern
"Avec la guerre en Ukraine, la campagne d'Eric Zemmour minée par ... - Le Monde",CH,fr,2022-03-05,Current Information War,Switzerland,25,Jura
Personne ne peut entrer sans passeport biométrique - Luxemburger Wort - Edition Francophone,CH,fr,2022-03-05,Problems Refugee Management,Switzerland,22,Solothurn
Le gouvernement flamand prévoit 1.000 euros par place d'accueil dédiée aux réfugiés ukrainiens pour les entités... - lalibre.be,CH,fr,2022-03-05,Local Communities,Switzerland,40,Grisons
"Guerre en Ukraine et appels aux boycotts en France : ""Il y a un ... - franceinfo",CH,fr,2022-03-05,Refugee Routes from Ukraine,Switzerland,23,Nidwalden
Ukraine: la Ligue des Droits de l’Homme prend position - lequotidien.re,CH,fr,2022-03-05,Volunteering and Donations,Switzerland,22,Zug
Trois façons d'aider les Ukrainiens | La Presse - La Presse,CH,fr,2022-03-05,Volunteering and Donations,Switzerland,18,Lower Saxony
Pourparlers entre la Russie et l'Ukraine | Une troisième session aura ... - La Presse,CH,fr,2022-03-05,Sanktions Russia and War Strategy,Switzerland,24,Bavaria
"Guerre en Ukraine : docteur en géopolitique, Pierre Verluise s ... - franceinfo",CH,fr,2022-03-05,Current Information War,Switzerland,24,Bern
Témoignage | Le calvaire des Ukrainiens qui ont dû tout quitter pour ... - Euronews,CH,fr,2022-03-05,Volunteering and Donations,Switzerland,26,Aargau
"Montpellier : la MRI, la voie pour l’hébergement des futurs réfugiés d’Ukraine - Midi Libre",CH,fr,2022-03-05,Local Communities,Switzerland,29,Schleswig-Holstein
Tilques : un havre de paix au cœur du marais se prépare à accueillir ... - La Voix du Nord,CH,fr,2022-03-05,Volunteering and Donations,Switzerland,31,Baden-Württemberg
Ukraine aktuell: Israel bemüht sich um Vermittlung - DW (Deutsch),DE,de,2022-03-05,Accomodation,Germany,20,Vaud
Kostenfreies Fußballtraining in Evershagen - Ostsee Zeitung,CH,de,2022-03-05,Volunteering and Donations,Switzerland,17,Appenzell Innerrhoden
Historikerin Olha Martynyuk über die Identität der Ukrainer - NZZ Magazin,CH,de,2022-03-05,Volunteering and Donations,Switzerland,21,Appenzell Ausserrhoden
Justizministerin Keller-Sutter über den Umgang mit Flüchtlingen - NZZ Magazin,CH,de,2022-03-05,Accomodation,Switzerland,24,Basel
"« On est vraiment accueillis » : à Calais, les Ukrainiens sont des ... - Sud Ouest",CH,fr,2022-03-05,Volunteering and Donations,Switzerland,23,Schleswig-Holstein
Dunkerque : 20 migrants sur une embarcation en difficulté secourus ... - La Voix du Nord,CH,fr,2022-03-05,Migration Apart from Ukraine,Switzerland,24,Appenzell Ausserrhoden
Guerre en Ukraine : les réfugiés ukrainiens sont-ils tous accueillis de la même manière dans le monde ? - LaDepeche.fr,CH,fr,2022-03-05,Local Communities,Switzerland,36,Schwyz
"«Je veux travailler ici, apprendre la langue» : à Lille, les premiers réfugiés ukrainiens arrivent - Europe 1",CH,fr,2022-03-05,Current Information Refugees,Switzerland,36,Obwalden
Guerre en Ukraine : Londres invite 150 réfugiés «à faire demi-tour» pour «se rendre à Paris ou Bruxelles» - Le Parisien,CH,fr,2022-03-05,Current Information Refugees,Switzerland,37,Saxony-Anhalt
L'accueil des réfugiés ukrainiens se précise en Haute-Vienne et en Corrèze - France Bleu,CH,fr,2022-03-05,Local Communities,Switzerland,30,Saarland
Guerre en Ukraine : des réfugiés ukrainiens continuent d'organiser ... - franceinfo,CH,fr,2022-03-05,Local Communities,Switzerland,25,Nidwalden
Guerre en Ukraine : vous souhaitez aider les Ukrainiens ? Voici les initiatives mises en place en Occitanie - LaDepeche.fr,CH,fr,2022-03-05,Volunteering and Donations,Switzerland,32,Jura
"Réfugiés ukrainiens : lieux de collecte, dons de matériels, vêtements, comment aider sur Millau - Midi Libre",CH,fr,2022-03-05,Local Communities,Switzerland,35,Saxony-Anhalt
"""Rischiava di compiere crimini di guerra"": la Cassazione concede asilo a ucraino del Donbass fuggito per non … - La Repubblica",CH,it,2022-03-05,Local Communities,Switzerland,39,Solothurn
"Guerra Russia-Ucraina, il prete di Leopoli pronto a dare battaglia: “Qui servono caschi e giubbotti… - Il Fatto Quotidiano",CH,it,2022-03-05,Sanktions Russia and War Strategy,Switzerland,40,Obwalden
"Guerra Russia-Ucraina, scatta il piano di accoglienza: dagli hotel a tamponi e vaccini - Il Fatto Quotidiano",CH,it,2022-03-05,Children and Human Rights,Switzerland,35,Saxony-Anhalt
In fuga dall'Ucraina. La Svizzera si aspetta 2'400 profughi - Liberatv.ch,CH,it,2022-03-05,Current Information Refugees,Switzerland,29,Hamburg
"Profughi ucraini, il personale dell'UNHCR da oggi è presente anche alla frontiera di Tarvisio per assistere i… - la Repubblica",CH,it,2022-03-05,Volunteering and Donations,Switzerland,38,Valais
"Ucraina, la guerra vista dall’Università: Bari organizza un simposio su Dostoevskij - Corriere del Mezzogiorno",CH,it,2022-03-05,Current Information War,Switzerland,35,Grisons
"Ucraina, 700mila i bambini in fuga: Anna ha passato il confine con due bimbi, Artem con tre - Il Sole 24 ORE",CH,it,2022-03-05,Children and Human Rights,Switzerland,38,Grisons
Come aiutare i rifugiati ucraini a Berlino: tutte le informazioni del ... - Il Mitte,CH,it,2022-03-05,Current Information Refugees,Switzerland,27,Bern
"Roma, corteo per la pace contro la guerra in Ucraina. Gli organizzatori: “Siamo in 50mila” - Il Fatto Quotidiano",CH,it,2022-03-05,Volunteering and Donations,Switzerland,40,Schwyz
"Intervista a Padre Camillo Ripamonti: “Non ci sono profughi di Serie a e di Serie b, che errore ignorare ... - Il Riformista",CH,it,2022-03-05,Problems Refugee Management,Switzerland,39,Solothurn
"Ucraina, no alla ‘solidarietà selettiva’ tra profughi di serie A e quelli di serie Z a cui voltare le spalle - Globalist.it",CH,it,2022-03-05,Local Communities,Switzerland,38,Grisons
"Ucraina, i militari russi sparano in aria durante le proteste a Kherson - Globalist.it",CH,it,2022-03-05,Sanktions Russia and War Strategy,Switzerland,24,Basel
L'immensa folla di profughi ucraini nella stazione centrale di Berlino - AGI - Agenzia Italia,CH,it,2022-03-05,Current Information Refugees,Switzerland,31,Nidwalden
"Ucraina, in moto la macchina dell'accoglienza: appello al commissario Santoro, a Rometta arrivano i primi bimbi - MessinaToday",CH,it,2022-03-05,Volunteering and Donations,Switzerland,40,Jura
L'odioso portato della guerra in Ucraina. Le violenze raccapriccianti ... - Farodiroma,CH,it,2022-03-05,Current Information War,Switzerland,28,Obwalden
"Ucraina: accoglienza sì, razzismo no! - L'Incontro",CH,it,2022-03-05,Current Information Refugees,Switzerland,21,Thurgau
"Guerra, le storie di razzismo e discriminazione contro asiatici e africani al confine tra l'Ucraina e la Polo… - la Repubblica",CH,it,2022-03-05,Current Information Refugees,Switzerland,39,Grisons
Il Rosone e Villa Angela per ospitare i profughi dall'Ucraina - Lo Strillone,CH,it,2022-03-05,Local Communities,Switzerland,24,Baden-Württemberg
"Ucraina, Viktoriya Prokopovych: “Commossa da tanta solidarietà” - Redattore Sociale",CH,it,2022-03-05,Volunteering and Donations,Switzerland,27,Zug
Oltre 100 profughi “dimenticati” recuperati in mare dalle navi Geo Barents e Open Arms - La Stampa,CH,it,2022-03-05,Migration Apart from Ukraine,Switzerland,31,Lucerne
Le profezie di Nostradamus su Putin e la guerra Ucraina-Russia: “La Grande Città assediata e l’... - Il Riformista,CH,it,2022-03-05,Sanktions Russia and War Strategy,Switzerland,38,Schaffhausen
"Monfalcone, scoppia la polemica su 'veri e falsi profughi' - Il Friuli",CH,it,2022-03-05,Accomodation,Switzerland,27,Lower Saxony
Guerra in Ucraina è catastrofe culturale - Il Sole 24 ORE,CH,it,2022-03-05,Current Information War,Switzerland,20,Schaffhausen
"Lamezia, poesie e canti per il popolo ucraino: il messaggio di pace ... - Il Lametino",CH,it,2022-03-05,Volunteering and Donations,Switzerland,30,Solothurn
"“Abbiamo ucciso nostro negoziatore, era una spia della Russia”, l’operazione in Ucraina a... - Il Riformista",CH,it,2022-03-05,Sanktions Russia and War Strategy,Switzerland,34,Bremen
"La protezione temporanea per gli ucraini in fuga prorogata di 6 mesi - Gli Stranieri, news immigrazione",CH,it,2022-03-05,Local Communities,Switzerland,35,Basel
"Tamponi e vaccini per i rifugiati dall'Ucraina, hub dell'Asl al ... - Nuova Irpinia",CH,it,2022-03-05,Local Communities,Switzerland,30,Schwyz
"Ucraina, RideMovi regala abbonamenti ai rifugiati accolti a Firenze - 055firenze",CH,it,2022-03-05,Current Information Refugees,Switzerland,27,Vaud
Le quattro lezioni dell'Ucraina: i doppi standard occidentali - Il Manifesto,CH,it,2022-03-05,Volunteering and Donations,Switzerland,22,Valais
"Guerra in Ucraina, il video dell'imboscata russa alla troupe di Sky News - Sky Tg24",CH,it,2022-03-05,Sanktions Russia and War Strategy,Switzerland,27,Schleswig-Holstein
Trenta profughi dall'Ucraina in arrivo nelle prossime ore a ... - Eco Risveglio,CH,it,2022-03-05,Local Communities,Switzerland,27,Obwalden
"Francica, le opere del maestro Liguori all’asta per sostenere i rifugiati ucraini - Il Vibonese",CH,it,2022-03-05,Local Communities,Switzerland,32,Mecklenburg-Vorpommern
"Carrara insieme alla città gemella Opole per aiutare l'Ucraina, da ... - La Voce Apuana",CH,it,2022-03-05,Volunteering and Donations,Switzerland,30,Ticino
"Profughi Ucraina, in questura a Bergamo rilasciati i primi permessi di soggiorno: come funziona - Corriere Bergamo - Corriere della Sera",CH,it,2022-03-05,Local Communities,Switzerland,44,Solothurn
Perché la Russia ha attaccato la centrale nucleare di Zaporizhzhia e quali sono i rischi - Il Riformista,CH,it,2022-03-05,Sanktions Russia and War Strategy,Switzerland,31,Schwyz
Ucraina: dona anche da utenze MVNO al 45525. Gli operatori abilitati - MVNO News,CH,it,2022-03-05,Volunteering and Donations,Switzerland,28,Nidwalden
"Ucraina-Russia, le notizie di sabato 5 marzo. Il premier di Israele da Putin: si propone come mediatore - Corriere della Sera",CH,it,2022-03-05,Sanktions Russia and War Strategy,Switzerland,39,North Rhine-Westphalia
"Afghans ""migrants"", Ukrainiens ""réfugiés"" : racisme médiatique ... - Arrêt sur images",CH,fr,2022-03-06,Current Information Refugees,Switzerland,28,Glarus
Guerre en Ukraine : la Pologne est le pays qui accueille pour le ... - franceinfo,CH,fr,2022-03-06,Refugee Routes from Ukraine,Switzerland,22,Lower Saxony
Calais : 250 réfugiés ukrainiens refoulés par le Royaume-Uni à la ... - France 3 Régions,CH,fr,2022-03-06,Local Communities,Switzerland,33,Hesse
Guerre en Ukraine : « Vladimir Poutine n’est pas un tyran qui se réveille » - La Croix,CH,fr,2022-03-06,Sanktions Russia and War Strategy,Switzerland,26,Saxony-Anhalt
Pasolini et les migrants | Le Club - Le Club de Mediapart,CH,fr,2022-03-06,Problems Refugee Management,Switzerland,15,Schleswig-Holstein
Guerre en Ukraine: Eric Zemmour change d'avis sur les réfugiés - Var-matin,CH,fr,2022-03-06,Local Communities,Switzerland,24,Sankt Gallen
"Accueil des Ukrainiens : «Comme pour la crise en 2015, la France n'accueillera pas tout le monde mais... - Europe 1",CH,fr,2022-03-06,Refugee Routes from Ukraine,Switzerland,35,Schwyz
Ukraine : le chef de l'ONU demande que les zones de conflit soient ... - ONU Info,CH,fr,2022-03-06,Current Information War,Switzerland,24,Saxony
Accueil des réfugiés ukrainiens à Perpignan : nouvel appel aux dons de la Ville et du diocèse - L'Indépendant,CH,fr,2022-03-06,Local Communities,Switzerland,38,Valais
Sanctions : le prix des soins médicaux en Russie a augmenté de 20 ... - Emergency Live,CH,fr,2022-03-06,Sanktions Russia and War Strategy,Switzerland,24,Mecklenburg-Vorpommern
Guerre en Ukraine : plus de 4600 manifestants auraient été arrêtés ... - Le Figaro,CH,fr,2022-03-06,Volunteering and Donations,Switzerland,24,Glarus
"Pétrole: le baril de Brent frôle les 140 dollars, proche du record absolu - BFM Business",CH,fr,2022-03-06,Volunteering and Donations,Switzerland,26,Uri
Situation de la guerre en Ukraine : L'armée russe annonce l ... - mediacongo.net,CH,fr,2022-03-06,Sanktions Russia and War Strategy,Switzerland,22,Jura
Ukraine: le prix de l'once d'or dépasse les 2.000 dollars - Les Nouvelles Calédoniennes,CH,fr,2022-03-06,Volunteering and Donations,Switzerland,30,Rhineland-Palatinate
